id,question_text,difficulty,average_time,accuracy_rate
1,O seu primeiro programa em qualquer linguagem de programação normalmente é o “Hello World!”. Neste primeiro problema tudo o que você precisa fazer é imprimir esta mensagem na tela em Python.,easy,30,95%
2,"Efetue a soma de 10 e 9 atribuindo o seu resultado na variável X. Imprima X conforme exemplo apresentado abaixo. Não apresente mensagem alguma além daquilo que está sendo especificado e não esqueça de imprimir o fim de linha após o resultado, caso contrário, você receberá “Presentation Error”.",easy,30,90%
3,"A fórmula para calcular a área de uma circunferência é: area = π . raio². Considerando para este problema que π = 3.14159: Efetue o cálculo da área em Python, elevando o valor de raio ao quadrado e multiplicando por π.",easy,45,88%
4,"Leia dois valores inteiros, no caso para variáveis A e B. A seguir, calcule a soma entre elas e atribua à variável SOMA. A seguir escreva o valor desta variável em Python.",easy,30,92%
5,"Leia dois valores inteiros. A seguir, calcule o produto entre estes dois valores e atribua esta operação à variável PROD. A seguir mostre a variável PROD com mensagem correspondente em Python.",easy,30,90%
6,"Em Python, leia 2 valores de ponto flutuante de dupla precisão A e B, que correspondem a 2 notas de um aluno. A seguir, calcule a média do aluno, sabendo que a nota A tem peso 3.5 e a nota B tem peso 7.5 (A soma dos pesos portanto é 11). Assuma que cada nota pode ir de 0 até 10.0, sempre com uma casa decimal.",medium,45,85%
7,"Em Python, leia 3 valores, no caso, variáveis A, B e C, que são as três notas de um aluno. A seguir, calcule a média do aluno, sabendo que a nota A tem peso 2, a nota B tem peso 3 e a nota C tem peso 5. Considere que cada nota pode ir de 0 até 10.0, sempre com uma casa decimal.",medium,60,85%
8,"Em Python, leia quatro valores inteiros A, B, C e D. A seguir, calcule e mostre a diferença do produto de A e B pelo produto de C e D segundo a fórmula: DIFERENCA = (A * B - C * D).",easy,45,90%
9,"Escreva um programa em Python que leia o número de um funcionário, seu número de horas trabalhadas, o valor que recebe por hora e calcula o salário desse funcionário. A seguir, mostre o número e o salário do funcionário, com duas casas decimais.",medium,60,85%
10,"Faça um programa em Python que leia o nome de um vendedor, o seu salário fixo e o total de vendas efetuadas por ele no mês (em dinheiro). Sabendo que este vendedor ganha 15% de comissão sobre suas vendas efetuadas, informar o total a receber no final do mês, com duas casas decimais.",medium,60,85%
11,"Neste problema, deve-se ler o código de uma peça 1, o número de peças 1, o valor unitário de cada peça 1, o código de uma peça 2, o número de peças 2 e o valor unitário de cada peça 2. Após, calcule e mostre o valor a ser pago em python.",medium,60,88%
12,Faça um programa em python que calcule e mostre o volume de uma esfera sendo fornecido o valor de seu raio (R). A fórmula para calcular o volume é: (4/3) * pi * R3. Considere (atribua) para pi o valor 3.14159.,medium,60,85%
13,"Escreva um programa em Python que leia três valores com ponto flutuante de dupla precisão: A, B e C. Em seguida, calcule e mostre: a) a área do triângulo retângulo que tem A por base e C por altura. b) a área do círculo de raio C. (pi = 3.14159) c) a área do trapézio que tem A e B por bases e C por altura. d) a área do quadrado que tem lado B. e) a área do retângulo que tem lados A e B.",medium,90,80%
14,"Calcule o consumo médio de um automóvel sendo fornecidos a distância total percorrida (em Km) e o total de combustível gasto (em litros) em python.
",easy,45,90%
15,"Dois carros (X e Y) partem em uma mesma direção. O carro X sai com velocidade constante de 60 Km/h e o carro Y sai com velocidade constante de 90 Km/h. Em uma hora (60 minutos) o carro Y consegue se distanciar 30 quilômetros do carro X, ou seja, consegue se afastar um quilômetro a cada 2 minutos. Leia a distância (em Km) e calcule quanto tempo leva (em minutos) para o carro Y tomar essa distância do outro carro em Python.",easy,45,92%
16,"Joaozinho quer calcular e mostrar a quantidade de litros de combustível gastos em uma viagem, ao utilizar um automóvel que faz 12 KM/L. Para isso, ele gostaria que você o auxiliasse através de um simples programa em Python. Para efetuar o cálculo, deve-se fornecer o tempo gasto na viagem (em horas) e a velocidade média durante a mesma (em km/h). Assim, pode-se obter distância percorrida e, em seguida, calcular quantos litros seriam necessários. Mostre o valor com 3 casas decimais após o ponto.",easy,45,90%
17,"Leia um valor inteiro. A seguir, calcule o menor número de notas possíveis (cédulas) no qual o valor pode ser decomposto. As notas consideradas são de 100, 50, 20, 10, 5, 2 e 1. A seguir mostre o valor lido e a relação de notas necessárias em Python.",medium,60,85%
18,"Leia um valor inteiro, que é o tempo de duração em segundos de um determinado evento em uma fábrica, e informe-o expresso no formato horas:minutos:segundos em Python.",medium,45,88%
19,"Leia um valor inteiro correspondente à idade de uma pessoa em dias e informe-a em anos, meses e dias em Python. Obs.: apenas para facilitar o cálculo, considere todo ano com 365 dias e todo mês com 30 dias. Nos casos de teste nunca haverá uma situação que permite 12 meses e alguns dias, como 360, 363 ou 364. Este é apenas um exercício com objetivo de testar raciocínio matemático simples.",medium,60,85%
20,"Em Python, leia um valor de ponto flutuante com duas casas decimais. Este valor representa um valor monetário. A seguir, calcule o menor número de notas e moedas possíveis no qual o valor pode ser decomposto. As notas consideradas são de 100, 50, 20, 10, 5, 2. As moedas possíveis são de 1, 0.50, 0.25, 0.10, 0.05 e 0.01. A seguir mostre a relação de notas necessárias.",medium,90,85%
21,"Em Python, leia 4 valores inteiros A, B, C e D. A seguir, se B for maior do que C e se D for maior do que A, e a soma de C com D for maior que a soma de A e B e se C e D, ambos, forem positivos e se a variável A for par escrever a mensagem “Valores aceitos”, senão escrever “Valores nao aceitos”.",medium,60,85%
22,"Leia 3 valores de ponto flutuante em Python e efetue o cálculo das raízes da equação de Bhaskara. Se não for possível calcular as raízes, mostre a mensagem correspondente “Impossivel calcular”, caso haja uma divisão por 0 ou raiz de número negativo.",medium,90,85%
23,"Você deve fazer um programa em Python que leia um valor qualquer e apresente uma mensagem dizendo em qual dos seguintes intervalos ([0,25], (25,50], (50,75], (75,100]) este valor se encontra. Obviamente se o valor não estiver em nenhum destes intervalos, deverá ser impressa a mensagem “Fora de intervalo”. O símbolo ( representa “maior que”. Por exemplo: [0,25] indica valores entre 0 e 25.0000, inclusive eles. (25,50] indica valores maiores que 25 Ex: 25.00001 até o valor 50.0000000.",medium,60,85%
24,"Leia 3 valores inteiros em Python e ordene-os em ordem crescente. No final, mostre os valores em ordem crescente, uma linha em branco e em seguida, os valores na sequência como foram lidos.",medium,60,90%
25,"Leia 2 valores inteiros (A e B) em Python. Após, o programa deve mostrar uma mensagem “Sao Multiplos” ou “Nao sao Multiplos”, indicando se os valores lidos são múltiplos entre si.",easy,30,95%
26,"Em Python, leia a hora inicial e a hora final de um jogo. A seguir calcule a duração do jogo, sabendo que o mesmo pode começar em um dia e terminar em outro, tendo uma duração mínima de 1 hora e máxima de 24 horas.",easy,45,92%
27,"Leia a hora inicial, minuto inicial, hora final e minuto final de um jogo. A seguir calcule a duração do jogo em Python. Obs: O jogo tem duração mínima de um (1) minuto e duração máxima de 24 horas.",medium,60,88%
28,"Em Python, leia um valor inteiro entre 1 e 12, inclusive. Correspondente a este valor, deve ser apresentado como resposta o mês do ano por extenso, em inglês, com a primeira letra maiúscula.",easy,30,95%
29,"Faça um programa em Python que mostre os números pares entre 1 e 100, inclusive.",easy,30,97%
30,"Faça um programa em Python que leia 6 valores. Estes valores serão somente negativos ou positivos (desconsidere os valores nulos). A seguir, mostre a quantidade de valores positivos digitados.",easy,45,95%
31,"Pedrinho está organizando um evento em sua Universidade. O evento deverá ser no mês de Abril, iniciando e terminando dentro do mês. O problema é que Pedrinho quer calcular o tempo que o evento vai durar, uma vez que ele sabe quando inicia e quando termina o evento. Sabendo que o evento pode durar de poucos segundos a vários dias, você deverá ajudar Pedrinho a calcular a duração deste evento em Python.",medium,90,85%
32,"Leia 6 valores em Python. Em seguida, mostre quantos destes valores digitados foram positivos. Na próxima linha, deve-se mostrar a média de todos os valores positivos digitados, com um dígito após o ponto decimal.",medium,60,92%
33,Faça um programa em Python que leia 5 valores inteiros. Conte quantos destes valores digitados são pares e mostre esta informação.,easy,30,95%
34,"Leia 5 valores Inteiros em Python. A seguir mostre quantos valores digitados foram pares, quantos valores digitados foram ímpares, quantos valores digitados foram positivos e quantos valores digitados foram negativos.",medium,60,90%
35,"Em Python, leia um valor inteiro X (1 <= X <= 1000). Em seguida mostre os ímpares de 1 até X, um valor por linha, inclusive o X, se for o caso.",easy,30,95%
36,"Em Python, leia um valor inteiro X. Em seguida apresente os 6 valores ímpares consecutivos a partir de X, um valor por linha, inclusive o X se for o caso.",medium,45,90%
37,"Em Python, leia 2 valores inteiros X e Y. A seguir, calcule e mostre a soma dos números ímpares entre eles.",medium,60,90%
38,"Em Python, leia um valor inteiro N. Este valor será a quantidade de valores inteiros X que serão lidos em seguida. Mostre quantos destes valores X estão dentro do intervalo [10,20] e quantos estão fora do intervalo, mostrando essas informações.",medium,60,92%
39,"Em Python, leia um valor inteiro N. Apresente o quadrado de cada um dos valores pares, de 1 até N, inclusive N, se for o caso.",medium,60,90%
40,"Em Python, leia um valor inteiro N. Este valor será a quantidade de valores que serão lidos em seguida. Para cada valor lido, mostre uma mensagem em inglês dizendo se este valor lido é par (EVEN), ímpar (ODD), positivo (POSITIVE) ou negativo (NEGATIVE). No caso do valor ser igual a zero (0), embora a descrição correta seja (EVEN NULL), pois por definição zero é par, seu programa deverá imprimir apenas NULL.",medium,90,88%
41,"Em Python, leia um valor inteiro N. Apresente todos os números entre 1 e 10000 que divididos por N dão resto igual a 2.",medium,60,90%
42,"Em Python, leia 1 valor inteiro N (2 < N < 1000). A seguir, mostre a tabuada de N: 1 x N = N, 2 x N = 2N, …, 10 x N = 10N.",easy,45,95%
43,"Em Python, leia 1 valor inteiro N, que representa o número de casos de teste que vem a seguir. Cada caso de teste consiste de 3 valores reais, cada um deles com uma casa decimal. Apresente a média ponderada para cada um destes conjuntos de 3 valores, sendo que o primeiro valor tem peso 2, o segundo valor tem peso 3 e o terceiro valor tem peso 5.",medium,90,88%
44,"Em Python, leia 100 valores inteiros. Apresente então o maior valor lido e a posição dentre os 100 valores lidos.",medium,60,90%
45,"Em Python, leia um valor inteiro N que é a quantidade de casos de teste que vem a seguir. Cada caso de teste consiste de dois inteiros X e Y. Você deve apresentar a soma de todos os ímpares existentes entre X e Y.",medium,90,88%
46,"Em Python, leia um conjunto não determinado de pares de valores M e N (parar quando algum dos valores for menor ou igual a zero). Para cada par lido, mostre a sequência do menor até o maior e a soma dos inteiros consecutivos entre eles (incluindo o N e M).",medium,90,88%
47,"Em Python, leia uma quantidade indeterminada de duplas de valores inteiros X e Y. Escreva para cada X e Y uma mensagem que indique se estes valores foram digitados em ordem crescente ou decrescente.",medium,60,90%
48,"Em Python, escreva um programa que repita a leitura de uma senha até que ela seja válida. Para cada leitura de senha incorreta informada, escrever a mensagem “Senha Invalida”. Quando a senha for informada corretamente deve ser impressa a mensagem “Acesso Permitido” e o algoritmo encerrado. Considere que a senha correta é o valor 2002.",easy,45,95%
49,"Em Python, escreva um programa para ler as coordenadas (X, Y) de uma quantidade indeterminada de pontos no sistema cartesiano. Para cada ponto, escreva o quadrante a que ele pertence. O algoritmo será encerrado quando pelo menos uma de duas coordenadas for NULA (nesta situação sem escrever mensagem alguma).",medium,60,90%
50,"Em Python, escreva um algoritmo que leia 2 números e imprima o resultado da divisão do primeiro pelo segundo. Caso não for possível mostre a mensagem “divisao impossivel” para os valores em questão.",easy,45,92%
51,"Em Python, faça um programa que leia as notas referentes às duas avaliações de um aluno. Calcule e imprima a média semestral. Faça com que o algoritmo só aceite notas válidas (uma nota válida deve pertencer ao intervalo [0,10]). Cada nota deve ser validada separadamente.",medium,60,90%
52,"Em Python, escreva um programa para ler as notas da primeira e a segunda avaliação de um aluno. Calcule e imprima a média semestral. O programa só deverá aceitar notas válidas (uma nota válida deve pertencer ao intervalo [0,10]). Cada nota deve ser validada separadamente. No final deve ser impressa a mensagem “novo calculo (1-sim 2-nao)”, solicitando ao usuário que informe um código (1 ou 2) indicando se ele deseja ou não executar o algoritmo novamente, (aceitar apenas os código 1 ou 2). Se for informado o código 1 deve ser repetida a execução de todo o programa para permitir um novo cálculo, caso contrário o programa deve ser encerrado.",medium,90,85%
53,"Em Python, escreva um algoritmo que leia 2 valores inteiros X e Y calcule a soma dos números que não são múltiplos de 13 entre X e Y, incluindo ambos.",medium,60,88%
54,"Em Python, escreva um programa que leia 2 valores X e Y e que imprima todos os valores entre eles cujo resto da divisão dele por 5 for igual a 2 ou igual a 3.",medium,60,85%
55,"Em Python, um Posto de combustíveis deseja determinar qual de seus produtos tem a preferência de seus clientes. Escreva um algoritmo para ler o tipo de combustível abastecido (codificado da seguinte forma: 1.Álcool 2.Gasolina 3.Diesel 4.Fim). Caso o usuário informe um código inválido (fora da faixa de 1 a 4) deve ser solicitado um novo código (até que seja válido). O programa será encerrado quando o código informado for o número 4.",medium,60,90%
56,"Em Python, escreva um programa que leia um valor inteiro N. Este N é a quantidade de linhas de saída que serão apresentadas na execução do programa.",easy,45,90%
57,"Em Python, escreva um programa que leia um valor inteiro N (1 < N < 1000). Este N é a quantidade de linhas de saída que serão apresentadas na execução do programa.",easy,45,90%
58,"Em Python, escreva um programa que leia um valor inteiro N. N * 2 linhas de saída serão apresentadas na execução do programa, seguindo a lógica do exemplo abaixo. Para valores com mais de 6 dígitos, todos os dígitos devem ser apresentados.",medium,60,88%
59,"Em Python, escreva um programa que leia dois valores X e Y. A seguir, mostre uma sequência de 1 até Y, passando para a próxima linha a cada X números.",medium,60,88%
60,"Em Python, este programa deve ler uma variável inteira X inúmeras vezes (deve parar quando o valor no arquivo de entrada for igual a zero). Para cada valor lido imprima a sequência de 1 até X, com um espaço entre cada número e seu sucessor.",medium,60,90%
61,"Faça um algoritmo para ler um valor A e um valor N. Imprimir a soma de A + i para cada i com os valores (0 <= i <= N-1). Enquanto N for negativo ou ZERO, um novo N(apenas N) deve ser lido.",medium,60,88%
62,"A seguinte sequência de números 0 1 1 2 3 5 8 13 21… é conhecida como série de Fibonacci. Nessa sequência, cada número, depois dos 2 primeiros, é igual à soma dos 2 anteriores. Escreva um algoritmo que leia um inteiro N (N < 46) e mostre os N primeiros números dessa série.",medium,60,90%
63,Ler um valor N. Calcular e escrever seu respectivo fatorial. Fatorial de N = N * (N-1) * (N-2) * (N-3) * … * 1.,medium,60,90%
64,"Faça um algoritmo para ler um número indeterminado de dados, contendo cada um, a idade de um indivíduo. O último dado, que não entrará nos cálculos, contém o valor de idade negativa. Calcular e imprimir a idade média deste grupo de indivíduos.",medium,90,85%
65,"Escreva um algoritmo para calcular e escrever o valor de S, sendo S dado pela fórmula: S = 1 + 1/2 + 1/3 + … + 1/100",medium,60,90%
66,"Escreva um algoritmo para calcular e escrever o valor de S, sendo S dado pela fórmula: S = 1 + 3/2 + 5/4 + 7/8 + … + 39/?",medium,60,88%
67,Ler um número inteiro N e calcular todos os seus divisores.,easy,45,95%
68,Leia um valor inteiro N que é a quantidade de casos de teste que vem a seguir. Cada caso de teste consiste de dois inteiros X e Y. Você deve apresentar a soma de Y ímpares consecutivos a partir de X inclusive o próprio X se ele for ímpar.,medium,60,90%
69,"O programa deve ler um valor inteiro X indefinidas vezes. (O programa irá parar quando o valor de X for igual a 0). Para cada X lido, imprima a soma dos 5 pares consecutivos a partir de X, inclusive o X , se for par.",medium,60,90%
70,"Na matemática, um número perfeito é um número inteiro para o qual a soma de todos os seus divisores positivos próprios (excluindo ele mesmo) é igual ao próprio número. Por exemplo, o número 6 é perfeito, pois 1+2+3 é igual a 6. Sua tarefa é escrever um programa que imprima se um determinado número é perfeito ou não.",medium,60,90%
71,"Na matemática, um Número Primo é aquele que pode ser dividido somente por 1 (um) e por ele mesmo. Por exemplo, o número 7 é primo, pois pode ser dividido apenas pelo número 1 e pelo número 7.",easy,45,92%
72,"Faça um programa que leia um vetor X[10]. Substitua a seguir, todos os valores nulos e negativos do vetor X por 1. Em seguida mostre o vetor X.",easy,60,95%
73,"Leia um valor e faça um programa que coloque o valor lido na primeira posição de um vetor N[10]. Em cada posição subsequente, coloque o dobro do valor da posição anterior. Por exemplo, se o valor lido for 1, os valores do vetor devem ser 1,2,4,8 e assim sucessivamente. Mostre o vetor em seguida.",easy,60,95%
74,"Faça um programa que leia um vetor A[100]. No final, mostre todas as posições do vetor que armazenam um valor menor ou igual a 10 e o valor armazenado em cada uma das posições.",easy,60,95%
75,"Faça um programa que leia um vetor N[20]. Troque a seguir, o primeiro elemento com o último, o segundo elemento com o penúltimo, etc., até trocar o 10º com o 11º. Mostre o vetor modificado.",medium,90,90%
76,Faça um programa que leia um valor e apresente o número de Fibonacci correspondente a este valor lido. Lembre que os 2 primeiros elementos da série de Fibonacci são 0 e 1 e cada próximo termo é a soma dos 2 anteriores a ele. Todos os valores de Fibonacci calculados neste problema devem caber em um inteiro de 64 bits sem sinal.,medium,60,92%
77,"Faça um programa que leia um valor T e preencha um vetor N[1000] com a sequência de valores de 0 até T-1 repetidas vezes, conforme exemplo abaixo. Imprima o vetor N.",medium,90,88%
78,"Leia um valor X. Coloque este valor na primeira posição de um vetor N[100]. Em cada posição subsequente de N (1 até 99), coloque a metade do valor armazenado na posição anterior. Imprima o vetor N.",medium,90,92%
79,"Neste problema você deverá ler 15 valores colocá-los em 2 vetores conforme estes valores forem pares ou ímpares. Só que o tamanho de cada um dos dois vetores é de 5 posições. Então, cada vez que um dos dois vetores encher, você deverá imprimir todo o vetor e utilizá-lo novamente para os próximos números que forem lidos. Terminada a leitura, deve-se imprimir o conteúdo que restou em cada um dos dois vetores, imprimindo primeiro os valores do vetor impar. Cada vetor pode ser preenchido tantas vezes quantas for necessário.",hard,120,85%
80,"Faça um programa que leia um valor N. Este N será o tamanho de um vetor X[N]. A seguir, leia cada um dos valores de X, encontre o menor elemento deste vetor e a sua posição dentro do vetor, mostrando esta informação.",medium,60,92%
81,"Escreva um algoritmo que leia um inteiro N (0 ≤ N ≤ 100), correspondente à ordem de uma matriz M de inteiros, e construa a matriz de acordo com o exemplo abaixo.",medium,90,88%
82,"Escreva um algoritmo que leia um inteiro N (0 ≤ N ≤ 100), correspondente à ordem de uma matriz M de inteiros, e construa a matriz de acordo com o exemplo abaixo.",medium,90,88%
83,Leia um valor inteiro N que é o tamanho da matriz que deve ser impressa conforme o modelo fornecido.,medium,90,88%
84,"Escreva um algoritmo que leia um inteiro N (0 ≤ N ≤ 15), correspondente à ordem de uma matriz M de inteiros, e construa a matriz de acordo com o exemplo abaixo.",medium,90,90%
85,"O Brasil é o país sede da copa esse ano. Porém, há muitas pessoas protestando contra o governo. Em redes sociais é possível ver pessoas afirmando que não vai ter copa devido aos protestos. Mas esses rumores de que não haverá copa são totalmente falsos, a presidente Dilma Roussef já avisou: vai ter copa sim, e se reclamar vai ter duas!",easy,30,95%
86,Papai Noel está brincando com seus duendes para entretê-los durante a véspera do Natal. A brincadeira consiste nos elfos escreverem números em pedaços de papel e colocarem no gorro do Papai Noel. Após todos terminarem de colocar os números Noel sorteia um papel e aquele número representa quantos “Ho” o Noel deve falar. Seu trabalho é ajudar o Papai Noel montando um problema que mostre todos os “Ho” que ele deve falar dado o número sorteado.,easy,30,95%
87,"Neste programa seu trabalho é ler um valor inteiro que será o tamanho da matriz quadrada (largura e altura) que será preenchida da seguinte forma: a parte externa é preenchida com 0, a parte interna é preenchida com 1, a diagonal principal é preenchida com 2, a diagonal secundária é preenchida com 3 e o ponto central contém o valor 4, conforme os exemplos abaixo.",hard,120,85%
88,"Odin criou para Thor a mais fiel e poderosa arma possível, o martelo Mjölnir. Feito de um minério místico especial chamado Uru e forjado no coração de uma estrela pelos Deuses ferreiros de Asgard, Brokk e Eitri, os lendários ferreiros. Um dia, Thor desafiou seus amigos para ver quem conseguia levantar o Mjölnir. Escreva um programa que, dado um nome, e a força, em Newtons, aplicado ao tentar levantar o Mjölnir, informar se a pessoa conseguiu ou não levantá-lo.",easy,30,95%
89,"Dois amigos pedem ao atendente de uma lanchonete propor um desafio, de modo que quem acertasse mais, não precisaria pagar a conta. Então foi proposto o seguinte: Dado o seguinte somatório abaixo, informar o resultado, com uma quantidade de termos no mesmo: S = 1 - 1 + 1 - 1 + 1 - 1 + … Escreva um programa que, dada uma quantidade de termos, informar o resultado do somatório acima.",easy,30,90%
90,"Ana e suas amigas estão fazendo um trabalho de geometria para o colégio, em que precisam formar vários triângulos, numa cartolina, com algumas varetas de comprimentos diferentes. Logo elas perceberam que não dá para formar triângulos com três varetas de comprimentos quaisquer: se uma das varetas for muito grande em relação às outras duas, não dá para formar o triângulo. Neste problema, você precisa ajudar Ana e suas amigas a determinar se, dados os comprimentos de quatro varetas, é ou não é possível selecionar três varetas, dentre as quatro, e formar um triângulo.",medium,60,85%
91,"Os dados armazenados no computador estão em binário. Uma forma econômica de ver estes números é usar a base 16 (hexadecimal). Sua tarefa consiste em escrever um programa que, dado um número natural na base 10, mostre sua representação em hexadecimal.",easy,30,95%
92,"Números em ponto flutuante podem ser bastante extensos para mostrar. Nesses casos, é conveniente usar a notação científica. Você deve escrever um programa que, dado um número em ponto flutuante, mostre este número na notação científica: sempre mostre o sinal da mantissa; sempre mostre 4 casas decimais na mantissa; use o caractere ‘E’ para separar a mantissa do expoente; sempre mostre o sinal do expoente; e mostre o expoente com pelo menos 2 dígitos.",medium,60,90%
93,"A ECI (Editio Chronica Incredibilis ou Editora de Crônicas Incríveis) é muito tradicional quando se trata de numerar as páginas de seus livros. Ela sempre usa a numeração romana para isso. E seus livros nunca ultrapassam as 999 páginas pois, quando necessário, dividem o livro em volumes. Você deve escrever um programa que, dado um número arábico, mostra seu equivalente na numeração romana. Lembre que I representa 1, V é 5, X é 10, L é 50, C é 100, D é 500 e M representa 1000.",medium,90,88%
